NAME,AMOUNT_REQUESTED__C,PROPOSAL_NAME_LONG_VERSION__C,APPLYING_INSTITUTION_NAME__C,AWARD_AMOUNT__C,DATE_CREATED__C,DATE_SUBMITTED__C,GRANT_PERIOD_END__C,GRANT_PERIOD_START__C,PROJECT_DESCRIPTION_PROPOSAL_ABSTRACT__C,ZENN_ID__C,STATUS__C,EXTERNAL_PROPOSAL_ID__C,APPLYING_INSTITUTION__C,PROGRAM_COHORT__C,RECORDTYPEID,PROPOSAL_FUNDER__C
Implementing Sustainable Micro-Enterprise,49280,Implementing Sustainable Micro-Enterprise,Ithaca College, ,2007-10-04,2007-10-19, , ,"The proposed Ithaca College (IC) project will bring a multi-disciplinary graduate and undergraduate student program to Ecuador to consult on sustainable micro-enterprise development and management. The students in this program are divided into four project teams. Our primary partner is Fundación Maquipucuna (FM), an Ecuadorian NGO with 19 years of experience in cloud-forest preservation and sustainable community development. The four teams will engage in the following activities: further development of a business plan for eco-educational tourism services targeted at the eco-tourist market coming to Ecuador from North America and Europe; work on a business plan to the patented process, developed through last year s NCIIA grant, for making plastic thatch for low-cost housing; further develop bio-diesel production as another sustainable enterprise in the communities surrounding the FM ecological reserve; help bring products to market to sell to  eco-tourists  that visit this area. Some of these products have been designed and now need business planning to become viable. These village-based businesses, built upon local need and with appropriate technology, will achieve sustainable economic development in Ecuador and provide experience in sustainability thinking for our IC students as they serve the Ecuadorian community. Products will be branded as part of the eco-label  master-brand  being developed by FM. Revenues and other  capitals  generated through these enterprises will strengthen FM s infrastructure and support its work to reduce poverty in the surrounding villages and increase support for its conservation efforts.",1004944,Invited Resubmit,4944-07,0017000001LSW1FAAX,a2C39000002zYt3EAE,012390000009qIDAAY,The Lemelson Foundation
Developing Sustainable Off-Grid Energy Systems in Rural Mali,50000,Developing Sustainable Off-Grid Energy Systems in Rural Mali,Iowa State University,46778,2007-10-05,2007-10-19,2010-07-30,2008-02-01,"This project proposes to improve the lives of rural Malians by using an innovative modular electrical system to address the need for locally controlled, economically feasible, and sustainable energy and lighting systems in rural villages. Students from Iowa State University (ISU) will work with students from the University of Bamako (UB) to develop reproducible and sustainable products that provide lighting and other energy needs for off-grid rural households. Initially, these efforts will focus on developing a battery-based energy system in which lead acid batteries are charged with solar panels and then rented to village families to provide lighting. A key innovation of this program is that it takes advantage of an underutilized resource: excess power from solar-powered village water systems. As part of this program, local entrepreneurs will be trained to implement and continue these activities as a local business. In addition, students will work to develop appropriate household products including lighting, fan-driven biomass stoves, and water purification devices that take advantage of this power source. There are three primary goals for this project: 1) Establish a locally controlled and reproducible business that keeps money in a village that would otherwise have been spent outside the village and provides lighting, 2) Expose students to the challenges of solving humanitarian problems across cultural differences with limited resources, providing students with a broader view of the world and exposure to the techniques of innovation and entrepreneurship, and 3) expand the growing partnership between ISU, UB, and Medicine for Mali.",1004947,Funded,4947-07,0017000001LSVnDAAX,a2C39000002zYt3EAE,012390000009qIDAAY,The Lemelson Foundation
A Wind Power from Kites Demonstrator for Heifer International's Overlook Farm Learning Center,37869,A Wind Power from Kites Demonstrator for Heifer International's Overlook Farm Learning Center,Worcester Polytechnic Institute, ,2007-10-05,2007-10-18, , ,"Worcester Polytechnic Institute (WPI) will work to further develop a novel renewable energy concept - Wind Power from Kites.  The Wind Power from Kites concept retains the advantages of wind power, but is also low-cost, more friendly to the environment, and usable in regions with low wind speeds where wind turbines are not economical.  The three main objectives of the proposed work are to;        Build, test, implement and evaluate a one-kilowatt Wind Power from Kites Demonstrator at Heifer International s Overlook Farm Learning Center;     Educate engineering students and the public regarding sustainable development and renewable energy through innovative collaborations with Heifer International;     Gain experience with operating a wind power from kites system  in a rural, off-the-grid setting at Overlook Farm as a precursor to application in a developing nation.       The Wind Power from Kites Demonstrator converts the force created from the up-and-down motion of a large tethered kite into electrical energy using a power conversion mechanism located on the ground. The Overlook Farm Learning Center allows the public to gain understanding of the causes of poverty in developing nations by providing demonstrations of sustainable solutions through experiential activities. Two undergraduate project teams will develop the demonstrator in order to meet the program s educational objectives.  The project will be replicable at other Heifer International Learning Centers in the USA. The program s self-sustainability will be insured by establishing future synergies with WPI s Global Project Program which maintains student project centers in several developing nations including South Africa, Namibia, and Thailand.    ",1004949,Not Accepted,4949-07,0017000001LSW9zAAH,a2C39000002zYt3EAE,012390000009qIDAAY,The Lemelson Foundation
HOUSEHOLD ENERGY COST REDUCTION VIA COMMUNITY BASED INTERCONNECTIONS OF GREEN ENERGY TECHNOLOGIES,50000,HOUSEHOLD ENERGY COST REDUCTION VIA COMMUNITY BASED INTERCONNECTIONS OF GREEN ENERGY TECHNOLOGIES,Howard University, ,2007-10-05,2007-10-20, , ,"Energy prices for heat and electric power have grown considerably in recent years. While all Americans are burdened by higher energy prices, the real earnings of low-income households are reduced dramatically because energy costs are typically a greater portion of their expenses. Green energy technologies like solar power could be used to reduce monthly energy expenses, however these measures require high initial costs that are often out of reach for low-income households. To address the problem of high energy costs for low-income communities, this project has two key objectives:      -We will test our hypothesis that it is possible to implement green technologies in low-income communities, in a way that reduces monthly energy costs, if the initial costs and overall benefits are shared by groups of households within the community.      -We will develop a hands-on approach to educating households on ways to reduce energy consumption using data collected from households within the community.      For the first objective, ways of implementing green energy technologies in low-income communities will be demonstrated with computer simulations. The computer simulations will use data collected from households in the Austin community on Chicago s West Side. We anticipate that the computer simulation results will be used to develop sustainable business models to deliver green energy to low-income communities. The purpose of the second educational objective is to obtain immediate energy cost savings for households. Both project components will be performed in collaboration with Eyes on Austin, a non-profit that serves the Austin community.",1004951,Not Accepted,4951-07,0017000001LSVpFAAX,a2C39000002zYt3EAE,012390000009qIDAAY,The Lemelson Foundation
Rainwater Harvesting for Safe Water in Cambodia: Advancing the Art,49691,Rainwater Harvesting for Safe Water in Cambodia: Advancing the Art,The University of Alabama, ,2007-10-09,2007-10-17, , ,"Properly treated and piped drinking water does not exist in Cambodia.  Arsenic-contaminated groundwater and highly impacted surface waters require often costly or impractical treatment to be safe.  Local NGOs are exploring alternative options provided by rainwater harvesting, however, from household scale systems to larger ones designed to serve schools and other community buildings.   Challenges facing the use of rainwater on a broader scale include water quality issues, since water may become contamination during storage.  Local NGOs are exploring various means for protecting water quality, such as roof maintenance, first flush systems to divert the first rain away from the storage tank, granular media (sand) filters, ceramic filters, and chemical treatment.  There is currently a lack of understanding of what precautions/treatments are appropriate for protecting harvested rainwater and best practices for achieving potable water.  This project seeks to stimulate development of rainwater harvesting in Cambodia and in the region by providing critical guidance on design and operation of potable water systems.          This project aims to:    Evaluate current systems for water quality protection in rainwater harvesting as practiced in rural Cambodia by examining 50+ individual systems of all sizes and design;    Establish a set of  best practices  for use by Cambodian NGOs, the private sector, and government ministries for protection of caught rainwater; and    Collaborate with local colleagues to build capacity among university students and young professionals through a training program in water quality testing and sustainable development.      ",1004958,Invited Resubmit,4958-07,0017000001LSW1dAAH,a2C39000002zYt3EAE,012390000009qIDAAY,The Lemelson Foundation
Building a sustainable drip irrigation system in Guatemala,50000,Building a sustainable drip irrigation system in Guatemala,Florida Atlantic University, ,2007-10-09,2007-10-17, , ,"Building a sustainable drip irrigation system in Guatemala   Summary:  The proposed project builds on traditional skills of poor farmers in Guatemala, and adds technical skills and tools to transform arid land into fertile soil that will enable farmers to cultivate year-round crops.    Outcome objectives:     After training, participants will install, run, and maintain a drip irrigation system.     After training, participants will start and maintain a record of cultivation of crops, harvest, and sales.     By the end of the first year of the implementation of the program, participants will identify and implement at least two marketing principles.    Sustainability is guaranteed by the active involvement of families, local government, and USA universities. Students at FAU and other US universities  will have available and accessible places for internship and field work studies in the academic fields of engineering, agronomy,  agriculture, health, social work, among others.    Of the requested $50,000, 82% will purchase equipment and materials. Small water pumps and water tanks placed at regular intervals, will bring water from a river to, approximately 500 feet up the mountain where a drip irrigation system will be installed.  Careful placement of the drips by each plant will allow the water to satisfy the needs of the root system of each plant saving, thereby, thousands of gallons of water, preventing runoffs, and producing richer harvests.  Because of the accessibility of water, a year-round cultivation of various crops will be possible, and the people s lives will be improved.               ",1004961,Not Accepted,4961-07,0017000001LSVrrAAH,a2C39000002zYt3EAE,012390000009qIDAAY,The Lemelson Foundation
Conserving wildlife and alleviating poverty through wildlife-friendly enterprises,50000,Conserving wildlife and alleviating poverty through wildlife-friendly enterprises,University of Wisconsin-Madison, ,2007-10-10,2007-10-22, , ,"Wealthy consumers and corporations are increasingly concerned with social and environmental responsibility. The rural poor living alongside charismatic, endangered wildlife in far-away, wild places can benefit from the wealthy markets that result. Otherwise, developing-country producers have little reason to tolerate tigers, elephants or bears that eat their crops or livestock. Without human tolerance, these animals are unlikely to survive for long. Linking responsible consumers who love animals to producers able to protect their property and coexist with wildlife could alleviate poverty and conserve wildlife simultaneously. For such wildlife-friendly enterprises to take root and flourish, producers must reach enough consumers and these consumers need confidence their purchases truly contribute to poverty alleviation and wildlife conservation. Enter the Wildlife Enterprise Network (WEN), a consortium of 26 private-sector and non-profit organizations from eight countries, co-founded by the UW-Madison principal investigator. WEN members help producers coexist with imperiled wildlife and reach lucrative markets. Promising pilot products include Tiger-Friendly® ginseng (Russian Far East), Elephant Pepper® (southern Africa), and Snow Leopard Trust® wool products (Mongolia) among others. This proposal marshals the business and environmental expertise of a major university to bring selected wildlife-friendly products to market readiness. Specifically, we will     train producers in Western consumer values, import/export requirements, and quality criteria of retailers;      transfer technology and train rural communities to protect property, manage wildlife non-lethally and verify wildlife are thriving; and     measure consumer satisfaction with products and marketing (with pro bono support from Dupuis Group).",1004963,Not Accepted,4963-07,0017000001LSVu9AAH,a2C39000002zYt3EAE,012390000009qIDAAY,The Lemelson Foundation
Hydraulic Hybrid Retrofits for Developing Nations,50000,Hydraulic Hybrid Retrofits for Developing Nations,Colorado State University,50000,2007-10-10,2007-10-25,2009-01-01,2008-02-01,"This multidisciplinary Colorado State University (CSU) team intends to take well-developed hydraulic hybrid vehicle technology, reengineer it specifically for diesel trucks and buses in developing nations, produce it with local manufacturers, and sell it using a financing structure that is prearranged and supports itself.  Developing market-based incentives to reduce pollution and providing the financing to make it available will create a self-sustaining enterprise.      The program combines undergraduate capstone courses in Mechanical and Electrical engineering with a MSBA program in sustainable enterprises (Global Social Sustainable Enterprises).  Oversight is provided by CSU s Engine and Energy Conversion Laboratory (EECL) which has, on two occasions, successfully taken technology from developed to developing nations in a sustainable model.  CSU is partnering with Czero, Inc., a local engineering firm with expertise in this area.  Czero intends to commercialize the product and has engineers dedicated to the project.  The EECL has relations with several foreign universities in target regions and will partner with one of them when the exact location to introduce the product is established.        The objectives of this grant are:     Develop a low cost hydraulic hybrid vehicle specifically to retrofit a variety of trucks and buses in developing nations with diesel fuel savings of 20-30% and reduction of particulate emissions by 40-50%     Analyze best-market opportunity for entry and establish a market-based, sustainable financing mechanism for retrofitting vehicles, including the use of carbon credits.      Create a business plan and form a company to commercialize the hydraulic hybrid retrofit technology.    ",1004964,Funded,4964-07,0017000001LSVvwAAH,a2C39000002zYt3EAE,012390000009qIDAAY,The Lemelson Foundation
ecoMOD: Home Energy and Environmental Monitoring,50000,ecoMOD: Home Energy and Environmental Monitoring,University of Virginia-Main Campus, ,2007-10-10,2007-10-19, , ,"The University of Virginia's ecoMOD project is a multi-year research, design, build, and evaluate project.  It is a joint venture of the Architecture and Engineering schools and includes numerous disciplines and specializations within these schools.  The aim of the project is to create well designed, high quality homes that minimize living costs and environmental impact, while providing all the general amenities of a typical home.  In order to evaluate the homes and develop methods of providing energy use feedback to residents, the team plans to develop and incorporate a commercially marketable energy and environmental monitoring system.      The goals of the system are:    &#61485; Develop a system capable of giving real time feedback about energy usage and environmental conditions in the most meaningful way to non-technical residents.   &#61485; Design a system that can be manufactured in large quantities at a low enough cost to make it commercially viable and competitive.   &#61485; Develop a system capable of capturing and storing detailed data points in order to evaluate the energy usage of the home and provide quantitative data that allows the ecoMOD team to find inefficiencies and ameliorate them in future homes.      The real time feedback to the residents will allow them to make more efficient decisions and the feedback to the project participants will enable them to perform a much more detailed evaluation of the home.  The system has great market potential among homeowners and property management companies, especially in the age of ever increasing energy costs and increased environmental awareness.     ",1004965,Not Accepted,4965-07,0017000001LSW8FAAX,a2C39000002zYt3EAE,012390000009qIDAAY,The Lemelson Foundation
"Low Cost Solar Water Heater (SolWorks Innovations Inc., formerly CalSolAgua)",38210,"Low Cost Solar Water Heater (SolWorks Innovations Inc., formerly CalSolAgua)",University of California-Berkeley,38210,2007-10-10,2007-10-17,2009-09-30,2008-02-01,"The Low Cost Solar Water Heater team aims to develop and implement a solar water heater for use in Guatemalan households. By reducing the need for traditional energy sources, solar water heating can reduce energy costs for Guatemalan households and reduce global environmental impacts. Based on the prototype developed this spring and summer, the group seeks support for detailed field tests to determine its effectiveness at reaching the team s various economic and environmental goals. Partnering with a development infrastructure NGO in Guatemala, the team will produce an implementation plan that will allow the NGO to manufacture these heaters locally, providing jobs to local community members. The team is an interdisciplinary group of eight current and former graduate students at UC-Berkeley. The students are supported by professors and engineers with backgrounds in technology development and business ventures in developing countries. By developing a product and implementation plan that is easily replicable throughout the developing world, this project has the potential to have an enormous impact on low-income households and the global environment.      Project Objectives:        Finalize design and complete field tests of a solar water heater that is environmentally-friendly, affordable, and meets the bathing needs of low-income households.     Develop an implementation plan that will allow the partner NGO to mass-produce and sell the solar water heater to households in Xela, Guatemala.     Provide student group members with an opportunity to apply skills from each of their respective disciplines collaboratively with organizations in the development field.",1004966,Funded,4966-07,0017000001LSVsvAAH,a2C39000002zYt3EAE,012390000009qIDAAY,The Lemelson Foundation
Solar Energy Powered Water De-mineralization System,50000,Solar Energy Powered Water De-mineralization System,The University of Texas at Arlington, ,2007-10-11,2007-10-18, , ,"Providing low-cost and culturally appropriate water purification systems to developing regions remains an unfulfilled mission.  Remote villages with hut-like living quarters have no infrastructure to bring electricity or water to the homes.  Despite the many water purification technologies, none are suitable for regions with limited resources that cannot support the associated drawbacks.  This grant will support continuing work for the development of a water de-mineralization system, known as the High Intensity De-ionization System (HIDS), suitable for manufacture, implementation, and maintenance in poverty-stricken regions.  The current HIDS is capable of removing numerous unwanted minerals from water.  The ultra-low power requirements make it an attractive alternative to other purification methods.  In addition, HIDS is designed for manual fabrication of most components and easy, low-cost maintenance.  The areas below are critical to rendering the HIDS transferable to developing regions and will be the focus of this investigation.         Efforts will focus on increasing the ion-capture capacity of the de-mineralizing coils to improve the performance of the HIDS for ground water with high mineral content for the Native American areas in the desert southwest.          A study will be performed to reduce power requirements for the HIDS.  Gains in efficiency may be obtainable through design modifications of the coil.  It is expected that the operating power can be reduced to a level achievable through solar energy.  A power budget and feasibility study of a solar-powered HIDS will be completed.          A customized solar power supply unit will be prototyped and tested with a HIDS.     ",1004970,Not Accepted,4970-07,0017000001LSVoqAAH,a2C39000002zYt3EAE,012390000009qIDAAY,The Lemelson Foundation
Visudi - A Novel Physics for Globally Sustainable Water Purification,50000,Visudi - A Novel Physics for Globally Sustainable Water Purification,Arizona State University, ,2007-10-11,2007-10-22, , ,"Fresh water has become one of the most imperiled natural resources in the world.  We propose an inexpensive, robust and completely novel technology - capable of suiting an unusually broad range of markets and demands.  Our team members combine a passionate pursuit and vision, handling of multiple research disciplines, and entrepreneurial excellence.  Our company, Sufficiently Advanced Technology, seeks to provide a novel technology for globally sustainable purification.        The strength of this approach is in its ability to offer a high-flow, continuous purification process that condenses the pollutant phase, making possible the recovery of useful resources.  The concentration would occur via an extremely dependable, non-reactant, non-filter, non-moving part, no replacement necessary process.  At the core of the proposed technology is a vortex phenomena unlike known mechanisms.  Our realization of this phenomena is a trade-secret advantage.      We sit in a unique position to have global impact.  Our method may be operated without electricity, replacements, or maintenance - making it ideal for sparse economic regions, both in cost and technique.  Other instantiations may improve manufacturing processes relevant to many industries - including biotech, aerospace, polymers, and agriculture.  If proven in a technology, the company stands to gain a significant share in the global water purification market, as well as play an instrumental role in reshaping the water industry itself.",1004971,Not Accepted,4971-07,0017000001LSVsUAAX,a2C39000002zYt3EAE,012390000009qIDAAY,The Lemelson Foundation
An educational model to address sustainability challenges in India,49775,An educational model to address sustainability challenges in India,Pace University-New York, ,2007-10-11,2007-10-18, , ,"In 1987, the UN Brundlandt commission defined sustainability as  development that meets the needs of the present without compromising the ability of future generations to meet their own needs .  While the economic achievements of India continue to make headlines, the caveat of this success is the toll it is taking on the environment.  As the economy expands and the population grows, the cities are choking with pollution.  Furthermore, there are challenges to the forests, water table and other sustaining resources.  This project will contribute to educating young people to sustainability issues, motivate some to pursue careers in solving sustainability problems, develop a transferable curriculum and recommend an classroom resource  kit  to support the curriculum.  The objectives of the program include:   &#61607; Developing an online GIS curriculum  and resource kit for science teachers addressing  sustainability issues   &#61607; Enhance an existing relationship with an inner city school in Bangalore to train  science teachers in the new curriculum and pilot with a select group of students   &#61607; Develop a project using GIS technology to analyze street level air pollution    ",1004972,Not Accepted,4972-07,0017000001LSVuEAAX,a2C39000002zYt3EAE,012390000009qIDAAY,The Lemelson Foundation
