NAME,AMOUNT_REQUESTED__C,PROPOSAL_NAME_LONG_VERSION__C,APPLYING_INSTITUTION_NAME__C,AWARD_AMOUNT__C,DATE_CREATED__C,DATE_SUBMITTED__C,GRANT_PERIOD_END__C,GRANT_PERIOD_START__C,PROJECT_DESCRIPTION_PROPOSAL_ABSTRACT__C,ZENN_ID__C,STATUS__C,EXTERNAL_PROPOSAL_ID__C,APPLYING_INSTITUTION__C,PROGRAM_COHORT__C,RECORDTYPEID,PROPOSAL_FUNDER__C
SUSTAINABLE PRODUCTION OF NON-WOOD TREE PRODUCTS: ESSENTIAL OILS FROM THE EAST AFRICAN SANDALWOOD,47500,SUSTAINABLE PRODUCTION OF NON-WOOD TREE PRODUCTS: ESSENTIAL OILS FROM THE EAST AFRICAN SANDALWOOD,The University of Texas at El Paso, ,2007-10-11,2007-10-19, , ,"SUSTAINABLE PRODUCTION OF NON-WOOD TREE PRODUCTS: ESSENTIAL OILS FROM THE EAST AFRICAN SANDALWOOD         Abstract      Solving ecological sustainability issues for commodities  through the eye of the market  has become a popular concept   making the indigenous peoples the custodians of biodiversity and rewarding them appropriately through Fair Trade schemes and other initiatives.       Osyris lanceolata (East African Sandalwood) is used as a raw material in the cosmetic and pharmaceutical industries. It grows ubiquitously in semi-arid areas in central, eastern and Rift Valley provinces, and also in neighboring Tanzania. Kenya may be the only place in East Africa where the tree still exists in appreciable quantities. The tree is also priceless in dry-land conservation.      The tree is highly prized in the global market with a tonne fetching as much as $15,000 with markets in Europe, South Africa, the Middle East, and Asia, especially in India where it is used in the manufacture of expensive perfumes and in medicinal uses. Lately, the tree has come under increasing attack from illegal harvesters and poachers with the wood being exported in form of logs and chips. Nearly all parts of the tree have economic value and unless a strategy for its sustainable exploitation is found, the tree faces total extinction.      This proposal draws on the successful experiences of ICIPE s Applied Bioprospecting Program successful model of income generation for local communities living adjacent to biodiversity-rich areas, domesticating, commercially cultivating and processing indigenous medicinal plants, including Ocimum kilimandscharicum, Mondia whytei, and Azadirachta indica.    ",1004973,Not Accepted,4973-07,0017000001LSVqgAAH,a2C39000002zYt3EAE,012390000009qIDAAY,The Lemelson Foundation
SUNRISE Renewables Model for a Biofuels Economy in Western Africa,50000,SUNRISE Renewables Model for a Biofuels Economy in Western Africa,University of North Dakota, ,2007-10-12,2007-10-17, , ,"This grant will be used to develop a business model for the development of the agricultural crops, production facilities, and transportation logistics required for a biofuels industry in Western Africa.  The model will be based on technology developed in the University of North Dakota s SUNRISE Renewables research center; technology that produces jet turbine and diesel transportation fuels as well as chemicals and polymers from oil seed crops.  SUNRISE will partner with Global Agricultural Solutions, (GAS) a NGO committed to the long-term alleviation of poverty in Western Africa, particularly Nigeria, through the use of agriculture-based production facilities.  The main objectives are:      Generate a business model specifically for Nigeria, but which can be then widely applied in West Africa and other 3rd world countries to alleviate poverty through economic development and employment in agricultural-based biofuels production facilities.     Provide cultural experience and business training of graduate and undergraduate students in chemical engineering, with minors in Entrepreneurship and Entrepreneurship undergraduates while establishing relationships with governmental agencies and businesses in Nigeria that will support and foster a biofuels economic initiative.     Use the business model results in partnership with SUNRISE Renewables commercial partners, including GAS to formulate and execute a plan to develop a biofuels economy in Western Africa.   ",1004975,Invited Resubmit,4975-07,0017000001LSVo9AAH,a2C39000002zYt3EAE,012390000009qIDAAY,The Lemelson Foundation
A Strategic Engineering Approach in Conceptualization of New Sustainable Water Purification Systems,50000,A Strategic Engineering Approach in Conceptualization of New Sustainable Water Purification Systems,University of Central Florida, ,2007-10-12,2007-10-22, , ,"Among 6 billion people in the world, 1 billion of them do not have access to clean water on a daily basis. In order to provide potable water to them, resource intensive means are used to  treat  water, which is then packaged, transported, and dispensed. Resources consumed in this purification and delivery process are mostly  lost  and become environmental wastes. The challenge of such water purification processes is to realize the environmentally sustainable technologies through engineering systems which in and of themselves are resource friendly and energy efficient from a global perspective.       The objective of this project is to create a novel simulation-based training program for engineering design innovation during product conceptualization. A simulation and visualization framework for lifecycle cost prediction in conceptual design will be created and used to train undergraduate and graduate engineering students. Students can learn to make decisions under uncertainties with the simulated environmental, economic, and social impacts included in product conceptualization. Multiple architectures for a sustainable water purification system will be developed by the students. These architectures will be realized with the aid of Bytomorrow, LLC and evaluated for fixed roof modules in a  green demonstration building  at the Florida House Learning Center (Sarasota). Training materials will be integrated in the curriculum at UCF and shared among the NSF Center for e-Design s academic and industry partners. Success stories will be disseminated to the public, including K-12, through demonstrations and seminars at the Florida House Learning Center.",1004976,Not Accepted,4976-07,0017000001LSVpyAAH,a2C39000002zYt3EAE,012390000009qIDAAY,The Lemelson Foundation
"Sustainable Development in Yoro, Honduras",50000,"Sustainable Development in Yoro, Honduras",Lafayette College, ,2007-10-12,2007-10-19, , ,"There is no human need more basic than potable water, and no single resource more fundamental to the survival of a society.  Progress towards a better life is virtually impossible in communities that lack basic water supply and sanitation.  It is, therefore, the objective of Engineers Without Borders Lafayette College (EWB-LC) to provide the infrastructure to meet these needs, and thus to foster an entrepreneurial environment in which people can improve their quality of life in a sustainable way.       Our three main objectives are:     Implementation of sustainable water infrastructure in El Convento.     Implementation of an entrepreneurial project in La Fortuna, and initiation of another such project in El Convento.      Evaluation and refinement of EWB-LC s sustainable development process (CODE-PSI).       EWB-LC has already successfully designed and completed water infrastructure projects in the Yoro region, and will draw upon this experience to implement a water system in El Convento.  A preliminary site assessment of this community has been conducted, and the chapter plans to allocate the Sustainable Vision funds towards completing the project implementation.    EWB-LC has also taken on the challenge of nurturing entrepreneurial projects in the communities in which we have helped establish basic infrastructure, as a way of building on this foundation, and helping the community move away from poverty and towards self-sustaining development.    Finally, EWB-LC has created a design framework for the development of sustainable rural infrastructure projects. This framework will be used in the completion of our objectives, and evaluated and refined in the process.    ",1004978,Not Accepted,4978-07,0017000001LSVzpAAH,a2C39000002zYt3EAE,012390000009qIDAAY,The Lemelson Foundation
Strengthening Manufacturing Capacity of Burmese Metalworking Firms to Promote Sustained Development,49480,Strengthening Manufacturing Capacity of Burmese Metalworking Firms to Promote Sustained Development,Stanford University,49480,2007-10-12,2007-10-18,2010-03-31,2008-02-01,"Stanford s Design for Extreme Affordability students and faculty will work with International Development Enterprises (IDE) - Myanmar to investigate manufacturing constraints and opportunities in Yangon, strengthen IDE s manufacturing capabilities and promote technological spillover to increase local metalworking capacity.  Without the capability to consistently produce treadle pumps at the needed quality and quantity, IDE-Myanmar is not effectively able to meet their mission of improving agricultural productivity of a large segment of Myanmar s rural poor.      Previous work aimed at strengthening small-scale manufacturing in less industrialized economies suggests that if introduced techniques (hardware, methods, processes) are appropriate and useful to manufacturers, they will diffuse within the formal and informal sectors.  As a result, product end users are able to purchase better quality products at the same cost, and manufacturers improve their workmanship and efficiency in production.        Our top three objectives are:     Design and implement a manufacturing system that enables IDE-Myanmar to meet their treadle pump production goals.     Capitalize on local social and economic mechanisms to promote sustained diffusion of useful techniques in Yangon s metalworking sectors.     Provide a strong educational experience for Stanford students and IDE-Myanmar staff as they address the challenges of sustainable product development in a low resource environment.      The model we propose to undertake emphasizes comprehensive need-finding in the manufacturing system design process.  A similar model was effectively implemented in Kenya with the NGO KickStart.  We believe this model to be replicable in a range of environments, with early stage focus on need-finding in the local environment.   ",1004979,Funded,4979-07,0017000001LSVwpAAH,a2C39000002zYt3EAE,012390000009qIDAAY,The Lemelson Foundation
Growing Healthy Families Hyrdoponically,47526,Growing Healthy Families Hyrdoponically,Temple University, ,2007-10-12,2007-10-22, , ,"One of the most glaring consequences of poverty is poor health caused by malnutrition.  In poverty-stricken populations, there is minimal focus on attaining a balanced diet, as this simply cannot be afforded.  The following provides an outline and brief description of the use of hydroponic gardening in alleviating some of the strains related to poverty.     It has been demonstrated that residents of the favelas, or shantytowns, of Rio de Janeiro can successfully maintain hydroponic gardens to grow vegetables on the roofs and walls of the shanties. Temple University has thus formed a team to further develop and implement a training program to teach favela residents how to design, install, and maintain hydroponic gardens for food production and income generation through sale of the gardens themselves.       The gardens will maximize the use of recovered materials and use Photo-Voltaic panels as an alternative power source, thereby reducing pollution.     Education of residents about nutrition, renewable technologies, and self sustainability.  The project will be geared towards pregnant teenagers, as young as   12 years old, in conjunction with Viva Rio s  Ana and Maria  program.   Preparation will include working with prison populations in Philadelphia, in conjunction with the  Inside Out  program, to teach prisoners who are nearing their release date about the advantages of gardening hydroponically. The sustainability of this project will be measured based on its ability to improve the quality of nutrition, and generate income.      ",1004983,Not Accepted,4983-07,0017000001LSVoTAAX,a2C39000002zYt3EAE,012390000009qIDAAY,The Lemelson Foundation
E-Cash: An East African Electronic Payment System for the Economically Disadvantaged,50000,E-Cash: An East African Electronic Payment System for the Economically Disadvantaged,Kennesaw State University, ,2007-10-13,2007-10-19, , ,"E-Cash is an innovative project designed to improve the lives of economically disadvantaged East Africans.  It involves three groups (1) the Kenyan NGO Ebony Foundation, a Kenyan Micro-Finance Institution which seeks to create wealth among low-income earners and rural populations by enabling them to improve their livelihood thereby integrating the poor into national economic development, (2) the Kabarak University Collegiate SIFE Team, and (3) the Kennesaw State University SIFE Team.        Ebony provides financial and technical services to low-income people in both urban and rural areas with particular emphasis on targeted support for marginalized underserved populations such as women, remote rural residents, and families affected by HIV/AIDs.      Ebony s E-Cash initiative is an electronic payment system that will provide financial services to low-income rural populations first in Kenya, then throughout all East Africa by enabling subscribers to receive, pay, and transfer electronic cash through the use of cellular telephones. An international team of U.S. and Kenyan SIFE students will work together to develop a plan for the implementation of Ebony s E-Cash system      The three major objectives of this E-Cash Proposal are to:      1. Develop a  Strategic Plan  for Launching the E-Cash system first in remote rural areas of Kenya, then nationally, and later throughout East Africa.      2. Secure market feedback to evaluate the effectiveness of the  Pilot  Launch, and use it to revise the Strategic Plan for implementing the E-Cash system throughout Kenya.        3. Develop a control system to  monitor  the national Launch and provide the feedback necessary to insure international success.   ",1004986,Not Accepted,4986-07,0017000001LSVoSAAX,a2C39000002zYt3EAE,012390000009qIDAAY,The Lemelson Foundation
Kayafungo Women's Water Project,50000,Kayafungo Women's Water Project,Washington State University, ,2007-10-14,2007-10-22, , ,"Engineers Without Borders at Washington State University (EWB@WSU) has partnered with the Student Movement for Real Change (SMRC) in an effort to provide clean water to 35,000 people in Kayafungo, Kenya.  The sustainable design and implementation of a 28 kilometer pipeline will help to alleviate poverty and health issues within the community by providing water within a closer proximity to the community's homesteads.  Direct access to water at several schools and health clinics will allow students to attend a full day's lecture and help stop the spread of disease.  This initiative empowers women by engaging local women s groups to manage water kiosks strategically placed along the pipeline.       The pipeline was proposed by the women of Kayafungo and will be built by all capable community members.  The pipeline will stem from a holding tank built by the Kenyan Government. EWB@WSU will implement construction and maintenance plans by providing hands-on training to community members.  Utilizing a bottom-up approach, this project promotes community ownership and will be coupled with a full health program including the additional installation of composting latrines.     ",1004990,Not Accepted,4990-07,0017000001LSVs1AAH,a2C39000002zYt3EAE,012390000009qIDAAY,The Lemelson Foundation
Livestock and Irrigated Vegetable Enterprises (LIVE) for Female Farmers in Cameroon,50000,Livestock and Irrigated Vegetable Enterprises (LIVE) for Female Farmers in Cameroon,Pennsylvania State University-Main Campus, ,2007-10-14,2007-10-22, , ,"In Cameroon, there is an urgent need to improving the livelihoods of women in rural areas since they are known as those who are deeply affected by the lack of real initiatives promoting income generating activities. Recent findings outline that access to electricity and other appropriate technologies and extension services could double the income of female farmers. However, most of the current technologies are not yet used by female farmers because of their limited access to affordable sources of energy.    This project aims to support women farming activities in promoting a model of commercially owned community energy utility using solar electricity. This model if successful, will help raise production and income for women, as well as improve the nutrition status of the family, mostly for the children. The solar electricity module will substantially improve economic and social livelihood conditions for women. More specifically, the development of such renewable technology aims to achieve the following:   Therefore, the three main objectives of the  LIVE  proposal are to:     Design and test a model of Profitable Community Owned Solar Electricity Utility to serve at least 300 rural households and their farm enterprises.     Develop a teaching package on how to establish a commercially owned community energy utility using renewable energy.     Train a core team of rural extension workers to transfer the technology and knowledge to entrepreneurial communities with focus on organizing women in rural areas as part of Common Groups Initiatives (CGI).   ",1004991,Not Accepted,4991-07,0017000001MBMSkAAP,a2C39000002zYt3EAE,012390000009qIDAAY,The Lemelson Foundation
"Using Mobile Phones and Web Services to Improve the Efficiency, Quality, and Liquidity of Small Rural Producers",49673,"Using Mobile Phones and Web Services to Improve the Efficiency, Quality, and Liquidity of Small Rural Producers",University of California-Berkeley, ,2007-10-14,2007-10-18, , ,"Small rural producers face serious challenges in entering the economic marketplace:       * Efficiency   Deficits in management, technical and physical capacity increase small producers' transaction costs compared to larger producers.      * Quality   Lack of enforceable production standards causes rural small producers to sell at commodity prices and lose out on certification or quality premiums       * Liquidity   Limited savings (and storage space) reduce the ability of small producers to sell their goods at the best price      Mobile phones have been demonstrated to improve the market performance of small rural producers in certain contexts.  The objective of this   project is to design, develop, implement and empirically evaluate a set of mobile phone applications and associated web services that   small producers can use to improve their 1) efficiency, 2) quality and 3) liquidity.      CAM is a mobile phone application framework that we have designed to meet the user interface and networking challenges of the rural developing world.  We have already developed and evaluated a CAM application for microfinance in India.  This system is now serving over 40,000 beneficiaries in Tamil Nadu, with plans of scaling as a new for-profit service enterprise.      Now, working in partnership with Aharaam, a network of 13 NGOs spread across 10 states of India, we are implementing another set of CAM   applications for small producer cooperatives.  These include mobile phone tools for managing procurement, certification and internal   control, as well as video tools for agricultural extension and dissemination of new practices and technologies.",1004992,Not Accepted,4992-07,0017000001LSVsvAAH,a2C39000002zYt3EAE,012390000009qIDAAY,The Lemelson Foundation
A low cost CD4 counter for AIDS in Africa,50000,A low cost CD4 counter for AIDS in Africa,Purdue University-Main Campus, ,2007-10-14,2007-10-19, , ,"This program links university technology development with a charity network called Cytometry for Life, whose goals are to bring low cost diagnostics to AIDS patients in Africa where these tests are not available because of high cost and high technology demands.  We have developed a very low cost device that can provide CD4 T cell counts that are absolutely necessary before AIDS patients can receive life-saving therapy. A huge percentage (>50%) of AIDS patients in African nations live in remote areas where these diagnostics are not available. Our counter is a small battery operated device, fully manually controlled but accurate and inexpensive. The university and the Cytometry for Life charity, and a number of scientists have teamed up to ensure development of low cost tests for those who cannot obtain them. We must develop quality systems approach with the clients to:      &#61558; Build the relationships between clients in African nations and design team   &#61558; Identify specific needs and hurdles for each region   &#61558; Create a knowledge network that links education and training needs for delivery of our new low cost diagnostic tools      The problem today is technology is so complex that it fails to achieve results outside of major hospitals in large cities in Africa. However, rural populations are essentially excluded from this essential test because it can only be performed in major hospitals today. Our small counter will change this paradigm giving life changing opportunities to those whose needs are greatest and resources are least.   ",1004993,Not Accepted,3993,0017000001MBMb3AAH,a2C39000002zYt3EAE,012390000009qIDAAY,The Lemelson Foundation
Microenterpise Development with Maasai Tribe-Kenya AFRICA,50000,Microenterpise Development with Maasai Tribe-Kenya AFRICA,University of Idaho, ,2007-10-15,2007-10-22, , ,"The University of Idaho has been working on a water filtration system for the Maasai people in Kenya, Africa since 2005 via funding from the University of Idaho and private support.  Last March, 2007, a team of five students and two professors visited Ngong Hills, Kenya and established a strong working relationship with a local NGO, with tribal elders, and with professors at the University of Nairobi.  The engineering team successfully designed a water filter prototype using all local materials, including moringa seeds.  In the course of working on the water project, the Idaho professors recognized other student learning opportunities that would enable the Maasai to create some sustainable micro-enterprises for this region.  One example is the growing, harvesting, packaging, and distribution of moringa seeds needed in the filter system.  The three main goals for this continuation project are to:  (1)  develop the necessary communication materials on the assembly of the water filter and work with our local contacts to translate and disseminate these materials to Maasai communities (2) work with the Maasai and the NGO to develop micro-enterprises that can help sustain the water project and enable the Maasai to have purchasing income for the filter components and (3) establish on-going student projects between the University of Nairobi and the University of Idaho.",1004994,Not Accepted,4994-07,0017000001LSVqtAAH,a2C39000002zYt3EAE,012390000009qIDAAY,The Lemelson Foundation
Partnership for Sustaining African Open Source Software Engineering Capacity,50000,Partnership for Sustaining African Open Source Software Engineering Capacity,San Jose State University, ,2007-10-15,2007-10-19, , ,"We propose a partnership between the AvoIR university network in Africa and San Jose State (SJSU), a university in California s Silicon Valley, to sustain and grow an open source software engineering practice in the African Continent.  This project with have three key objectives:        Expand access to software engineering training for underserved African students in the lowest socio-economic sectors     Foster partnerships among African and Silicon Valley students by involving them in joint software development projects supporting innovative solutions that address social needs     Generate higher visibility for the AvoIR network in Silicon Valley by engaging them in social innovation projects involving local industry and community partners      This partnership, initiated with a pilot project in 2007, will merge two well-evolved, multi-sector African and Silicon Valley networks.  AvoIR is a collaborative effort among several African higher education institutions to support capacity building in Free and Open Source software engineering.  The Social Innovation Initiative at SJSU is a network of university, industry and community partners committed to the development of economically viable solutions that address social needs. The sustainable vision grant will allow us to expand the partnership to include software projects that address social needs and to involve a greater number of African and SJSU students in the effort.   Ultimately, our goal is to leverage our global networks to attract investors to our efforts, successfully commercialize software solutions generated by the partnership, and establish sustainable organizations that promote viable, innovative solutions to social needs.   ",1004995,Invited Resubmit,4995-07,0017000001LSVznAAH,a2C39000002zYt3EAE,012390000009qIDAAY,The Lemelson Foundation
